label	isPartOf	subPropertyOf	equivalentProperty	subproperties	domainIncludes	rangeIncludes	inverseOf	supersedes	supersededBy	comment
about				mainEntity	CommunicateAction, CreativeWork, Event	Thing	subjectOf			The subject matter of the content.
abridged	https://bib.schema.org				Book	Boolean				Indicates whether the book is an abridged edition.
abstract	pending:				CreativeWork	Text				"An abstract is a short description that summarizes a <a class=""localLink"" href=""/CreativeWork"">CreativeWork</a>."
accelerationTime	https://auto.schema.org				Vehicle	QuantitativeValue				"The time needed to accelerate the vehicle from a given start velocity to a given target velocity.<br/><br/>

Typical unit code(s): SEC for seconds<br/><br/>

<ul>
<li>Note: There are unfortunately no standard unit codes for seconds/0..100 km/h or seconds/0..60 mph. Simply use ""SEC"" for seconds and indicate the velocities in the <a class=""localLink"" href=""/name"">name</a> of the <a class=""localLink"" href=""/QuantitativeValue"">QuantitativeValue</a>, or use <a class=""localLink"" href=""/valueReference"">valueReference</a> with a <a class=""localLink"" href=""/QuantitativeValue"">QuantitativeValue</a> of 0..60 mph or 0..100 km/h to specify the reference speeds.</li>
</ul>"
acceptedAnswer		suggestedAnswer			Question	Answer, ItemList				The answer(s) that has been accepted as best, typically on a Question/Answer site. Sites vary in their selection mechanisms, e.g. drawing on community opinion and/or the view of the Question author.
acceptedOffer					Order	Offer				The offer(s) -- e.g., product, quantity and price combinations -- included in the order.
acceptedPaymentMethod					Demand, Offer	LoanOrCredit, PaymentMethod				The payment method(s) accepted by seller for this offer.
acceptsReservations					FoodEstablishment	Boolean, Text, URL				Indicates whether a FoodEstablishment accepts reservations. Values can be Boolean, an URL at which reservations can be made or (for backwards compatibility) the strings <code>Yes</code> or <code>No</code>.
accessCode					DeliveryEvent	Text				Password, PIN, or access code needed for delivery (e.g. from a locker).
accessMode					CreativeWork	Text				"The human sensory perceptual system or cognitive faculty through which a person may process or perceive information. Values should be drawn from the <a href=""https://www.w3.org/2021/a11y-discov-vocab/latest/#accessMode-vocabulary"">approved vocabulary</a>."
accessModeSufficient					CreativeWork	ItemList				"A list of single or combined accessModes that are sufficient to understand all the intellectual content of a resource. Values should be drawn from the <a href=""https://www.w3.org/2021/a11y-discov-vocab/latest/#accessModeSufficient-vocabulary"">approved vocabulary</a>."
accessibilityAPI					CreativeWork	Text				"Indicates that the resource is compatible with the referenced accessibility API. Values should be drawn from the <a href=""https://www.w3.org/2021/a11y-discov-vocab/latest/#accessibilityAPI-vocabulary"">approved vocabulary</a>."
accessibilityControl					CreativeWork	Text				"Identifies input methods that are sufficient to fully control the described resource. Values should be drawn from the <a href=""https://www.w3.org/2021/a11y-discov-vocab/latest/#accessibilityControl-vocabulary"">approved vocabulary</a>."
accessibilityFeature					CreativeWork	Text				"Content features of the resource, such as accessible media, alternatives and supported enhancements for accessibility. Values should be drawn from the <a href=""https://www.w3.org/2021/a11y-discov-vocab/latest/#accessibilityFeature-vocabulary"">approved vocabulary</a>."
accessibilityHazard					CreativeWork	Text				"A characteristic of the described resource that is physiologically dangerous to some users. Related to WCAG 2.0 guideline 2.3. Values should be drawn from the <a href=""https://www.w3.org/2021/a11y-discov-vocab/latest/#accessibilityHazard-vocabulary"">approved vocabulary</a>."
accessibilitySummary					CreativeWork	Text				"A human-readable summary of specific accessibility features or deficiencies, consistent with the other accessibility metadata but expressing subtleties such as ""short descriptions are present but long descriptions will be needed for non-visual users"" or ""short descriptions are present and no long descriptions are needed."""
accommodationCategory	pending:	category			Accommodation	Text				"Category of an <a class=""localLink"" href=""/Accommodation"">Accommodation</a>, following real estate conventions, e.g. RESO (see <a href=""https://ddwiki.reso.org/display/DDW17/PropertySubType+Field"">PropertySubType</a>, and <a href=""https://ddwiki.reso.org/display/DDW17/PropertyType+Field"">PropertyType</a> fields  for suggested values)."
accommodationFloorPlan	pending:				Accommodation, Residence	FloorPlan				"A floorplan of some <a class=""localLink"" href=""/Accommodation"">Accommodation</a>."
accountId		identifier			Invoice	Text				The identifier for the account the payment will be applied to.
accountMinimumInflow	pending:				BankAccount	MonetaryAmount				A minimum amount that has to be paid in every month.
accountOverdraftLimit	pending:				BankAccount	MonetaryAmount				An overdraft is an extension of credit from a lending institution when an account reaches zero. An overdraft allows the individual to continue withdrawing money even if the account has no funds in it. Basically the bank allows people to borrow a set amount of money.
accountablePerson					CreativeWork	Person				Specifies the Person that is legally accountable for the CreativeWork.
acquireLicensePage	pending:	usageInfo			CreativeWork	CreativeWork, URL				Indicates a page documenting how licenses can be purchased or otherwise acquired, for the current item.
acquiredFrom					OwnershipInfo	Organization, Person				The organization or person from which the product was acquired.
acrissCode	https://auto.schema.org				BusOrCoach, Car	Text				The ACRISS Car Classification Code is a code used by many car rental companies, for classifying vehicles. ACRISS stands for Association of Car Rental Industry Systems and Standards.
actionAccessibilityRequirement					ConsumeAction	ActionAccessSpecification				A set of requirements that must be fulfilled in order to perform an Action. If more than one value is specified, fulfilling one set of requirements will allow the Action to be performed.
actionApplication					EntryPoint	SoftwareApplication		application		An application that can complete the request.
actionOption		object			ChooseAction	Text, Thing		option		A sub property of object. The options subject to this action.
actionPlatform					EntryPoint	DigitalPlatformEnumeration, Text, URL				The high level platform(s) where the Action can be performed for the given URL. To specify a specific application or operating system instance, use actionApplication.
actionStatus					Action	ActionStatusType				Indicates the current disposition of the Action.
actionableFeedbackPolicy	pending:	publishingPrinciples			NewsMediaOrganization, Organization	CreativeWork, URL				"For a <a class=""localLink"" href=""/NewsMediaOrganization"">NewsMediaOrganization</a> or other news-related <a class=""localLink"" href=""/Organization"">Organization</a>, a statement about public engagement activities (for news media, the newsroom’s), including involving the public - digitally or otherwise -- in coverage decisions, reporting and activities after publication."
activeIngredient					DietarySupplement, Drug, DrugStrength, Substance	Text				An active ingredient, typically chemical compounds and/or biologic substances.
activityDuration					ExercisePlan	Duration, QuantitativeValue				Length of time to engage in the activity.
activityFrequency					ExercisePlan	QuantitativeValue, Text				How often one should engage in the activity.
actor				readBy	Clip, CreativeWorkSeason, Episode, Event, Movie, MovieSeries, PodcastSeries, RadioSeries, TVSeries, VideoGame, VideoGameSeries, VideoObject	Person		actors		An actor, e.g. in TV, radio, movie, video games etc., or in an event. Actors can be associated with individual items or with a series, episode, clip.
actors					Clip, Episode, Movie, MovieSeries, RadioSeries, TVSeries, VideoGame, VideoGameSeries, VideoObject	Person			actor	An actor, e.g. in TV, radio, movie, video games etc. Actors can be associated with individual items or with a series, episode, clip.
addOn					Offer	Offer				An additional offer that can only be obtained in combination with the first base offer (e.g. supplements and extensions that are available for a surcharge).
additionalName		alternateName			Person	Text				An additional name for a Person, can be used for a middle name.
additionalNumberOfGuests					RsvpAction	Number				If responding yes, the number of guests who will attend in addition to the invitee.
additionalProperty					MerchantReturnPolicy, Place, Product, QualitativeValue, QuantitativeValue	PropertyValue				"A property-value pair representing an additional characteristic of the entity, e.g. a product feature or another characteristic for which there is no matching property in schema.org.<br/><br/>

Note: Publishers should be aware that applications designed to use specific schema.org properties (e.g. width, color, gtin13, ...) will typically expect such data to be provided using those properties, rather than using the generic property/value mechanism."
additionalType		http://www.w3.org/1999/02/22-rdf-syntax-ns#type			Thing	URL				An additional type for the item, typically used for adding more specific types from external vocabularies in microdata syntax. This is a relationship between something and a class that the thing is in. In RDFa syntax, it is better to use the native RDFa syntax - the 'typeof' attribute - for multiple types. Schema.org tools may have only weaker understanding of extra types, in particular those defined externally.
additionalVariable					ExercisePlan	Text				Any additional component of the exercise prescription that may need to be articulated to the patient. This may include the order of exercises, the number of repetitions of movement, quantitative distance, progressions over time, etc.
address					GeoCoordinates, GeoShape, Organization, Person, Place	PostalAddress, Text				Physical address of the item.
addressCountry					DefinedRegion, GeoCoordinates, GeoShape, PostalAddress	Country, Text				"The country. For example, USA. You can also provide the two-letter <a href=""http://en.wikipedia.org/wiki/ISO_3166-1"">ISO 3166-1 alpha-2 country code</a>."
addressLocality					PostalAddress	Text				The locality in which the street address is, and which is in the region. For example, Mountain View.
addressRegion					DefinedRegion, PostalAddress	Text				"The region in which the locality is, and which is in the country. For example, California or another appropriate first-level <a href=""https://en.wikipedia.org/wiki/List_of_administrative_divisions_by_country"">Administrative division</a>."
administrationRoute					Drug	Text				A route by which this drug may be administered, e.g. 'oral'.
advanceBookingRequirement					Demand, Offer	QuantitativeValue				The amount of time that is required between accepting the offer and the actual usage of the resource or service.
adverseOutcome					MedicalDevice, TherapeuticProcedure	MedicalEntity				"A possible complication and/or side effect of this therapy. If it is known that an adverse outcome is serious (resulting in death, disability, or permanent damage; requiring hospitalization; or otherwise life-threatening or requiring immediate medical attention), tag it as a seriousAdverseOutcome instead."
affectedBy					MedicalTest	Drug				Drugs that affect the test's results.
affiliation		memberOf			Person	Organization				An organization that this person is affiliated with. For example, a school/university, a club, or a team.
afterMedia					HowToDirection	MediaObject, URL				A media object representing the circumstances after performing this direction.
agent					Action	Organization, Person				The direct performer or driver of the action (animate or inanimate). E.g. <em>John</em> wrote a book.
aggregateRating					Brand, CreativeWork, Event, Offer, Organization, Place, Product, Service	AggregateRating				The overall rating, based on a collection of reviews or ratings, of the item.
aircraft					Flight	Text, Vehicle				"The kind of aircraft (e.g., ""Boeing 747"")."
album					MusicGroup	MusicAlbum		albums		A music album.
albumProductionType					MusicAlbum	MusicAlbumProductionType				Classification of the album by its type of content: soundtrack, live album, studio album, etc.
albumRelease					MusicAlbum	MusicRelease	releaseOf			A release of this album.
albumReleaseType					MusicAlbum	MusicAlbumReleaseType				The kind of release which this album is: single, EP or album.
albums					MusicGroup	MusicAlbum			album	A collection of music albums.
alcoholWarning					Drug	Text				Any precaution, guidance, contraindication, etc. related to consumption of alcohol while taking this drug.
algorithm					MedicalRiskScore	Text				The algorithm or rules to follow to compute the score.
alignmentType					AlignmentObject	Text				A category of alignment between the learning resource and the framework node. Recommended values include: 'requires', 'textComplexity', 'readingLevel', and 'educationalSubject'.
alternateName				additionalName	Thing	Text				An alias for the item.
alternativeHeadline					CreativeWork	Text				A secondary title of the CreativeWork.
alternativeOf	pending:				Gene	Gene				Another gene which is a variation of this one.
alumni					EducationalOrganization, Organization	Person	alumniOf			Alumni of an organization.
alumniOf					Person	EducationalOrganization, Organization	alumni			An organization that the person is an alumni of.
amenityFeature					Accommodation, FloorPlan, LodgingBusiness, Place	LocationFeatureSpecification				An amenity feature (e.g. a characteristic or service) of the Accommodation. This generic property does not make a statement about whether the feature is included in an offer for the main accommodation or available at extra costs.
amount					DatedMoneySpecification, InvestmentOrDeposit, LoanOrCredit, MonetaryGrant, MoneyTransfer	MonetaryAmount, Number				The amount of money.
amountOfThisGood					TypeAndQuantityNode	Number				The quantity of the goods included in the offer.
announcementLocation	pending:	spatialCoverage			SpecialAnnouncement	CivicStructure, LocalBusiness				"Indicates a specific <a class=""localLink"" href=""/CivicStructure"">CivicStructure</a> or <a class=""localLink"" href=""/LocalBusiness"">LocalBusiness</a> associated with the SpecialAnnouncement. For example, a specific testing facility or business with special opening hours. For a larger geographic region like a quarantine of an entire region, use <a class=""localLink"" href=""/spatialCoverage"">spatialCoverage</a>."
annualPercentageRate					FinancialProduct	Number, QuantitativeValue				The annual rate that is charged for borrowing (or made by investing), expressed as a single percentage number that represents the actual yearly cost of funds over the term of a loan. This includes any fees or additional costs associated with the transaction.
answerCount					Question	Integer				The number of answers this question has received.
answerExplanation	pending:				Answer	Comment, WebContent				A step-by-step or full explanation about Answer. Can outline how this Answer was achieved or contain more broad clarification or statement about it.
antagonist					Muscle	Muscle				The muscle whose action counteracts the specified muscle.
appearance	pending:	workExample			Claim	CreativeWork				"Indicates an occurrence of a <a class=""localLink"" href=""/Claim"">Claim</a> in some <a class=""localLink"" href=""/CreativeWork"">CreativeWork</a>."
applicableCountry	pending:				MerchantReturnPolicy	Country, Text				A country where a particular merchant return policy applies to, for example the two-letter ISO 3166-1 alpha-2 country code.
applicableLocation					DrugCost, DrugLegalStatus	AdministrativeArea				The location in which the status applies.
applicantLocationRequirements	pending:				JobPosting	AdministrativeArea				The location(s) applicants can apply from. This is usually used for telecommuting jobs where the applicant does not need to be in a physical office. Note: This should not be used for citizenship or work visa requirements.
application					EntryPoint	SoftwareApplication			actionApplication	An application that can complete the request.
applicationCategory					SoftwareApplication	Text, URL				Type of software application, e.g. 'Game, Multimedia'.
applicationContact	pending:				JobPosting	ContactPoint				Contact details for further information relevant to this job posting.
applicationDeadline	pending:				EducationalOccupationalProgram	Date				The date at which the program stops collecting applications for the next enrollment cycle.
applicationStartDate	pending:				EducationalOccupationalProgram	Date				The date at which the program begins collecting applications for the next enrollment cycle.
applicationSubCategory					SoftwareApplication	Text, URL				Subcategory of the application, e.g. 'Arcade Game'.
applicationSuite					SoftwareApplication	Text				The name of the application suite to which the application belongs (e.g. Excel belongs to Office).
appliesToDeliveryMethod					DeliveryChargeSpecification, PaymentChargeSpecification	DeliveryMethod				The delivery method(s) to which the delivery charge or payment charge specification applies.
appliesToPaymentMethod					PaymentChargeSpecification	PaymentMethod				The payment method(s) to which the payment charge specification applies.
archiveHeld	pending:				ArchiveOrganization	ArchiveComponent	holdingArchive			"Collection, <a href=""https://en.wikipedia.org/wiki/Fonds"">fonds</a>, or item held, kept or maintained by an <a class=""localLink"" href=""/ArchiveOrganization"">ArchiveOrganization</a>."
archivedAt	pending:				CreativeWork	URL, WebPage				"Indicates a page or other link involved in archival of a <a class=""localLink"" href=""/CreativeWork"">CreativeWork</a>. In the case of <a class=""localLink"" href=""/MediaReview"">MediaReview</a>, the items in a <a class=""localLink"" href=""/MediaReviewItem"">MediaReviewItem</a> may often become inaccessible, but be archived by archival, journalistic, activist, or law enforcement organizations. In such cases, the referenced page may not directly publish the content."
area					BroadcastService	Place			serviceArea	The area within which users can expect to reach the broadcast service.
areaServed				availableAtOrFrom, eligibleRegion	ContactPoint, DeliveryChargeSpecification, Demand, Offer, Organization, Service	AdministrativeArea, GeoShape, Place, Text		serviceArea		The geographic area where a service or offered item is provided.
arrivalAirport					Flight	Airport				The airport where the flight terminates.
arrivalBoatTerminal	pending:				BoatTrip	BoatTerminal				The terminal or port from which the boat arrives.
arrivalBusStop					BusTrip	BusStation, BusStop				The stop or station from which the bus arrives.
arrivalGate					Flight	Text				Identifier of the flight's arrival gate.
arrivalPlatform					TrainTrip	Text				The platform where the train arrives.
arrivalStation					TrainTrip	TrainStation				The station where the train trip ends.
arrivalTerminal					Flight	Text				Identifier of the flight's arrival terminal.
arrivalTime					Trip	DateTime, Time				The expected arrival time.
artEdition					VisualArtwork	Integer, Text				"The number of copies when multiple copies of a piece of artwork are produced - e.g. for a limited edition of 20 prints, 'artEdition' refers to the total number of copies (in this example ""20"")."
artMedium		material			VisualArtwork	Text, URL				The material used. (E.g. Oil, Watercolour, Acrylic, Linoprint, Marble, Cyanotype, Digital, Lithograph, DryPoint, Intaglio, Pastel, Woodcut, Pencil, Mixed Media, etc.)
arterialBranch					Artery	AnatomicalStructure		branch		The branches that comprise the arterial structure.
artform					VisualArtwork	Text, URL				e.g. Painting, Drawing, Sculpture, Print, Photograph, Assemblage, Collage, etc.
articleBody					Article	Text				The actual body of the article.
articleSection					Article	Text				Articles may belong to one or more 'sections' in a magazine or newspaper, such as Sports, Lifestyle, etc.
artist	https://bib.schema.org				ComicIssue, ComicStory, VisualArtwork	Person				"The primary artist for a work
        in a medium other than pencils or digital line art--for example, if the
        primary artwork is done in watercolors or digital paints."
artworkSurface					VisualArtwork	Text, URL		surface		The supporting materials for the artwork, e.g. Canvas, Paper, Wood, Board, etc.
asin	pending:	identifier			Demand, Offer, Product	Text, URL				"An Amazon Standard Identification Number (ASIN) is a 10-character alphanumeric unique identifier assigned by Amazon.com and its partners for product identification within the Amazon organization (summary from <a href=""https://en.wikipedia.org/wiki/Amazon_Standard_Identification_Number"">Wikipedia</a>'s article).<br/><br/>

Note also that this is a definition for how to include ASINs in Schema.org data, and not a definition of ASINs in general - see documentation from Amazon for authoritative details.
ASINs are most commonly encoded as text strings, but the [asin] property supports URL/URI as potential values too."
aspect					MedicalWebPage	Text			mainContentOfPage	An aspect of medical practice that is considered on the page, such as 'diagnosis', 'treatment', 'causes', 'prognosis', 'etiology', 'epidemiology', etc.
assembly					APIReference	Text			executableLibraryName	Library file name, e.g., mscorlib.dll, system.web.dll.
assemblyVersion					APIReference	Text				Associated product/technology version. E.g., .NET Framework 4.5.
assesses	pending:				CreativeWork, EducationEvent, LearningResource	DefinedTerm, Text				The item being described is intended to assess the competency or learning outcome defined by the referenced term.
associatedAnatomy					MedicalCondition, PhysicalActivity	AnatomicalStructure, AnatomicalSystem, SuperficialAnatomy				The anatomy of the underlying organ system or structures associated with this entity.
associatedArticle					MediaObject	NewsArticle				A NewsArticle associated with the Media Object.
associatedClaimReview	pending:	associatedReview			Review	Review				"An associated <a class=""localLink"" href=""/ClaimReview"">ClaimReview</a>, related by specific common content, topic or claim. The expectation is that this property would be most typically used in cases where a single activity is conducting both claim reviews and media reviews, in which case <a class=""localLink"" href=""/relatedMediaReview"">relatedMediaReview</a> would commonly be used on a <a class=""localLink"" href=""/ClaimReview"">ClaimReview</a>, while <a class=""localLink"" href=""/relatedClaimReview"">relatedClaimReview</a> would be used on <a class=""localLink"" href=""/MediaReview"">MediaReview</a>."
associatedDisease	pending:				BioChemEntity	MedicalCondition, PropertyValue, URL				Disease associated to this BioChemEntity. Such disease can be a MedicalCondition or a URL. If you want to add an evidence supporting the association, please use PropertyValue.
associatedMedia					CreativeWork, HyperToc, HyperTocEntry	MediaObject				A media object that encodes this CreativeWork. This property is a synonym for encoding.
associatedMediaReview	pending:	associatedReview			Review	Review				"An associated <a class=""localLink"" href=""/MediaReview"">MediaReview</a>, related by specific common content, topic or claim. The expectation is that this property would be most typically used in cases where a single activity is conducting both claim reviews and media reviews, in which case <a class=""localLink"" href=""/relatedMediaReview"">relatedMediaReview</a> would commonly be used on a <a class=""localLink"" href=""/ClaimReview"">ClaimReview</a>, while <a class=""localLink"" href=""/relatedClaimReview"">relatedClaimReview</a> would be used on <a class=""localLink"" href=""/MediaReview"">MediaReview</a>."
associatedPathophysiology					AnatomicalStructure, AnatomicalSystem, SuperficialAnatomy	Text				If applicable, a description of the pathophysiology associated with the anatomical system, including potential abnormal changes in the mechanical, physical, and biochemical functions of the system.
associatedReview	pending:			associatedClaimReview, associatedMediaReview	Review	Review				"An associated <a class=""localLink"" href=""/Review"">Review</a>."
athlete					SportsTeam	Person				"A person that acts as performing member of a sports team; a player as opposed to a coach."
attendee					Event	Organization, Person		attendees		A person or organization attending the event.
attendees					Event	Organization, Person			attendee	A person attending the event.
audience					CreativeWork, Event, LodgingBusiness, PlayAction, Product, Service	Audience		serviceAudience		An intended audience, i.e. a group for whom something was created.
audienceType					Audience	Text				The target group associated with a given audience (e.g. veterans, car owners, musicians, etc.).
audio					CreativeWork	AudioObject, Clip, MusicRecording				An embedded audio object.
authenticator					MediaSubscription	Organization				The Organization responsible for authenticating the user's subscription. For example, many media apps require a cable/satellite provider to authenticate your subscription before playing media.
