label	isPartOf	subPropertyOf	equivalentProperty	subproperties	domainIncludes	rangeIncludes	inverseOf	supersedes	supersededBy	comment
prepTime					HowTo, HowToDirection	Duration				"The length of time it takes to prepare the items to be used in instructions or a direction, in <a href=""http://en.wikipedia.org/wiki/ISO_8601"">ISO 8601 duration format</a>."
preparation					MedicalProcedure	MedicalEntity, Text				Typical preparation that a patient must undergo before having the procedure performed.
prescribingInfo					Drug	URL				Link to prescribing information for the drug.
prescriptionStatus					Drug	DrugPrescriptionStatus, Text				Indicates the status of drug prescription, e.g. local catalogs classifications or whether the drug is available by prescription or over-the-counter, etc.
previousItem					ListItem	ListItem				A link to the ListItem that precedes the current one.
previousStartDate					Event	Date				Used in conjunction with eventStatus for rescheduled or cancelled events. This property contains the previously scheduled start date. For rescheduled events, the startDate property should be used for the newly scheduled start date. In the (rare) case of an event that has been postponed and rescheduled multiple times, this field may be repeated.
price					Offer, PriceSpecification, TradeAction	Number, Text				"The offer price of a product, or of a price component when attached to PriceSpecification and its subtypes.<br/><br/>

Usage guidelines:<br/><br/>

<ul>
<li>Use the <a class=""localLink"" href=""/priceCurrency"">priceCurrency</a> property (with standard formats: <a href=""http://en.wikipedia.org/wiki/ISO_4217"">ISO 4217 currency format</a>, e.g. ""USD""; <a href=""https://en.wikipedia.org/wiki/List_of_cryptocurrencies"">Ticker symbol</a> for cryptocurrencies, e.g. ""BTC""; well known names for <a href=""https://en.wikipedia.org/wiki/Local_exchange_trading_system"">Local Exchange Trading Systems</a> (LETS) and other currency types, e.g. ""Ithaca HOUR"") instead of including <a href=""http://en.wikipedia.org/wiki/Dollar_sign#Currencies_that_use_the_dollar_or_peso_sign"">ambiguous symbols</a> such as '$' in the value.</li>
<li>Use '.' (Unicode 'FULL STOP' (U+002E)) rather than ',' to indicate a decimal point. Avoid using these symbols as a readability separator.</li>
<li>Note that both <a href=""http://www.w3.org/TR/xhtml-rdfa-primer/#using-the-content-attribute"">RDFa</a> and Microdata syntax allow the use of a ""content="" attribute for publishing simple machine-readable values alongside more human-friendly formatting.</li>
<li>Use values from 0123456789 (Unicode 'DIGIT ZERO' (U+0030) to 'DIGIT NINE' (U+0039)) rather than superficially similar Unicode symbols.</li>
</ul>"
priceComponent					CompoundPriceSpecification	UnitPriceSpecification				"This property links to all <a class=""localLink"" href=""/UnitPriceSpecification"">UnitPriceSpecification</a> nodes that apply in parallel for the <a class=""localLink"" href=""/CompoundPriceSpecification"">CompoundPriceSpecification</a> node."
priceComponentType	pending:				UnitPriceSpecification	PriceComponentTypeEnumeration				Identifies a price component (for example, a line item on an invoice), part of the total price for an offer.
priceCurrency					Offer, PriceSpecification, Reservation, Ticket, TradeAction	Text				"The currency of the price, or a price component when attached to <a class=""localLink"" href=""/PriceSpecification"">PriceSpecification</a> and its subtypes.<br/><br/>

Use standard formats: <a href=""http://en.wikipedia.org/wiki/ISO_4217"">ISO 4217 currency format</a>, e.g. ""USD""; <a href=""https://en.wikipedia.org/wiki/List_of_cryptocurrencies"">Ticker symbol</a> for cryptocurrencies, e.g. ""BTC""; well known names for <a href=""https://en.wikipedia.org/wiki/Local_exchange_trading_system"">Local Exchange Trading Systems</a> (LETS) and other currency types, e.g. ""Ithaca HOUR""."
priceRange					LocalBusiness	Text				The price range of the business, for example <code>$$$</code>.
priceSpecification					Demand, Offer, TradeAction	PriceSpecification				One or more detailed price specifications, indicating the unit price and delivery or payment charges.
priceType					CompoundPriceSpecification, UnitPriceSpecification	PriceTypeEnumeration, Text				"Defines the type of a price specified for an offered product, for example a list price, a (temporary) sale price or a manufacturer suggested retail price. If multiple prices are specified for an offer the <a class=""localLink"" href=""/priceType"">priceType</a> property can be used to identify the type of each such specified price. The value of priceType can be specified as a value from enumeration PriceTypeEnumeration or as a free form text string for price types that are not already predefined in PriceTypeEnumeration."
priceValidUntil					Offer	Date				The date after which the price is no longer available.
primaryImageOfPage					WebPage	ImageObject				Indicates the main image on the page.
primaryPrevention					MedicalCondition	MedicalTherapy				A preventative therapy used to prevent an initial occurrence of the medical condition, such as vaccination.
printColumn					NewsArticle	Text				The number of the column in which the NewsArticle appears in the print edition.
printEdition					NewsArticle	Text				The edition of the print product in which the NewsArticle appears.
printPage					NewsArticle	Text				If this NewsArticle appears in print, this field indicates the name of the page on which the article is found. Please note that this field is intended for the exact page name (e.g. A5, B18).
printSection					NewsArticle	Text				If this NewsArticle appears in print, this field indicates the print section in which the article appeared.
procedure					MedicalDevice	Text				A description of the procedure involved in setting up, using, and/or installing the device.
procedureType					MedicalProcedure	MedicalProcedureType				The type of procedure, for example Surgical, Noninvasive, or Percutaneous.
processingTime					ServiceChannel	Duration				Estimated processing time for the service using this channel.
processorRequirements					SoftwareApplication	Text				Processor architecture required to run the application (e.g. IA64).
producer					CreativeWork	Organization, Person				The person or organization who produced the work (e.g. music album, movie, TV/radio series etc.).
produces					Service	Thing			serviceOutput	The tangible thing generated by the service, e.g. a passport, permit, etc.
productGroupID	pending:				ProductGroup	Text				Indicates a textual identifier for a ProductGroup.
productID		identifier			Product	Text				"The product identifier, such as ISBN. For example: <code>meta itemprop=""productID"" content=""isbn:123-456-789""</code>."
productSupported					ContactPoint	Product, Text				"The product or service this support contact point is related to (such as product support for a particular product line). This can be a specific product or product line (e.g. ""iPhone"") or a general category of products or services (e.g. ""smartphones"")."
productionCompany					CreativeWorkSeason, Episode, MediaObject, Movie, MovieSeries, RadioSeries, TVSeries, VideoGameSeries	Organization				The production company or studio responsible for the item, e.g. series, video game, episode etc.
productionDate					Product, Vehicle	Date				The date of production of the item, e.g. vehicle.
proficiencyLevel					TechArticle	Text				"Proficiency needed for this content; expected values: 'Beginner', 'Expert'."
programMembershipUsed					Reservation	ProgramMembership				Any membership in a frequent flyer, hotel loyalty program, etc. being applied to the reservation.
programName					ProgramMembership	Text				The program providing the membership.
programPrerequisites	pending:				EducationalOccupationalProgram	AlignmentObject, Course, EducationalOccupationalCredential, Text				Prerequisites for enrolling in the program.
programType	pending:				EducationalOccupationalProgram	DefinedTerm, Text				The type of educational or occupational program. For example, classroom, internship, alternance, etc.
programmingLanguage					SoftwareSourceCode	ComputerLanguage, Text				The computer programming language.
programmingModel					APIReference	Text				Indicates whether API is managed or unmanaged.
propertyID					PropertyValue	Text, URL				"A commonly used identifier for the characteristic represented by the property, e.g. a manufacturer or a standard code for a property. propertyID can be
(1) a prefixed string, mainly meant to be used with standards for product properties; (2) a site-specific, non-prefixed string (e.g. the primary key of the property or the vendor-specific ID of the property), or (3)
a URL indicating the type of the property, either pointing to an external vocabulary, or a Web resource that describes the property (e.g. a glossary entry).
Standards bodies should promote a standard prefix for the identifiers of properties from their standards."
proprietaryName					DietarySupplement, Drug	Text				Proprietary name given to the diet plan, typically by its originator or creator.
proteinContent					NutritionInformation	Mass				The number of grams of protein.
provider	pending:				Action, CreativeWork, EducationalOccupationalProgram, Invoice, ParcelDelivery, Reservation, Service, Trip	Organization, Person		carrier		"The service provider, service operator, or service performer; the goods producer. Another party (a seller) may offer those services or goods on behalf of the provider. A provider may also serve as the seller."
providerMobility					Service	Text				Indicates the mobility of a provided service (e.g. 'static', 'dynamic').
providesBroadcastService					BroadcastChannel	BroadcastService	hasBroadcastChannel			The BroadcastService offered on this channel.
providesService					ServiceChannel	Service				The service provided by this channel.
publicAccess					Place	Boolean				"A flag to signal that the <a class=""localLink"" href=""/Place"">Place</a> is open to public visitors.  If this property is omitted there is no assumed default boolean value"
publicTransportClosuresInfo	pending:				SpecialAnnouncement	URL, WebContent				Information about public transport closures.
publication					CreativeWork	PublicationEvent				A publication event associated with the item.
publicationType					MedicalScholarlyArticle	Text				"The type of the medical article, taken from the US NLM MeSH publication type catalog. See also <a href=""http://www.nlm.nih.gov/mesh/pubtypes.html"">MeSH documentation</a>."
publishedBy	https://bib.schema.org				PublicationEvent	Organization, Person				An agent associated with the publication event.
publishedOn					PublicationEvent	BroadcastService				A broadcast service associated with the publication event.
publisher					CreativeWork	Organization, Person				The publisher of the creative work.
publisherImprint	https://bib.schema.org				CreativeWork	Organization				The publishing division which published the comic.
publishingPrinciples				actionableFeedbackPolicy, correctionsPolicy, diversityStaffingReport, masthead, missionCoveragePrioritiesPolicy, noBylinesPolicy, ownershipFundingInfo, unnamedSourcesPolicy, verificationFactCheckingPolicy	CreativeWork, Organization, Person	CreativeWork, URL				"The publishingPrinciples property indicates (typically via <a class=""localLink"" href=""/URL"">URL</a>) a document describing the editorial principles of an <a class=""localLink"" href=""/Organization"">Organization</a> (or individual, e.g. a <a class=""localLink"" href=""/Person"">Person</a> writing a blog) that relate to their activities as a publisher, e.g. ethics or diversity policies. When applied to a <a class=""localLink"" href=""/CreativeWork"">CreativeWork</a> (e.g. <a class=""localLink"" href=""/NewsArticle"">NewsArticle</a>) the principles are those of the party primarily responsible for the creation of the <a class=""localLink"" href=""/CreativeWork"">CreativeWork</a>.<br/><br/>

While such policies are most typically expressed in natural language, sometimes related information (e.g. indicating a <a class=""localLink"" href=""/funder"">funder</a>) can be expressed using schema.org terminology."
purchaseDate					Product, Vehicle	Date				The date the item, e.g. vehicle, was purchased by the current owner.
qualifications	pending:				JobPosting, Occupation	EducationalOccupationalCredential, Text				Specific qualifications required for this role or Occupation.
quarantineGuidelines	pending:				SpecialAnnouncement	URL, WebContent				Guidelines about quarantine rules, e.g. in the context of a pandemic.
query		instrument			SearchAction	Text				A sub property of instrument. The query used on this action.
quest					Game, VideoGameSeries	Thing				The task that a player-controlled character, or group of characters may complete in order to gain a reward.
question		object			AskAction	Question				A sub property of object. A question.
rangeIncludes	https://meta.schema.org				Property	Class				Relates a property to a class that constitutes (one of) the expected type(s) for values of the property.
ratingCount					AggregateRating	Integer				The count of total number of ratings.
ratingExplanation	pending:				Rating	Text				"A short explanation (e.g. one to two sentences) providing background context and other information that led to the conclusion expressed in the rating. This is particularly applicable to ratings associated with ""fact check"" markup using <a class=""localLink"" href=""/ClaimReview"">ClaimReview</a>."
ratingValue					Rating	Number, Text				"The rating for the content.<br/><br/>

Usage guidelines:<br/><br/>

<ul>
<li>Use values from 0123456789 (Unicode 'DIGIT ZERO' (U+0030) to 'DIGIT NINE' (U+0039)) rather than superficially similar Unicode symbols.</li>
<li>Use '.' (Unicode 'FULL STOP' (U+002E)) rather than ',' to indicate a decimal point. Avoid using these symbols as a readability separator.</li>
</ul>"
readBy	https://bib.schema.org	actor			Audiobook	Person				A person who reads (performs) the audiobook.
readonlyValue					PropertyValueSpecification	Boolean				"Whether or not a property is mutable.  Default is false. Specifying this for a property that also has a value makes it act similar to a ""hidden"" input in an HTML form."
realEstateAgent		participant			RentAction	RealEstateAgent				A sub property of participant. The real estate agent involved in the action.
recipe		instrument			CookAction	Recipe				A sub property of instrument. The recipe/instructions used to perform the action.
recipeCategory					Recipe	Text				The category of the recipe—for example, appetizer, entree, etc.
recipeCuisine					Recipe	Text				The cuisine of the recipe (for example, French or Ethiopian).
recipeIngredient		supply			Recipe	Text		ingredients		A single ingredient used in the recipe, e.g. sugar, flour or garlic.
recipeInstructions		step			Recipe	CreativeWork, ItemList, Text				A step in making the recipe, in the form of a single item (document, video, etc.) or an ordered list with HowToStep and/or HowToSection items.
recipeYield		yield			Recipe	QuantitativeValue, Text				The quantity produced by the recipe (for example, number of people served, number of servings, etc).
recipient		participant		bccRecipient, ccRecipient, toRecipient	AuthorizeAction, CommunicateAction, DonateAction, GiveAction, Message, PayAction, ReturnAction, SendAction, TipAction	Audience, ContactPoint, Organization, Person				A sub property of participant. The participant who is at the receiving end of the action.
recognizedBy	pending:				EducationalOccupationalCredential	Organization				An organization that acknowledges the validity, value or utility of a credential. Note: recognition may include a process of quality assurance or accreditation.
recognizingAuthority					MedicalEntity	Organization				If applicable, the organization that officially recognizes this entity as part of its endorsed system of medicine.
recommendationStrength					MedicalGuidelineRecommendation	Text				Strength of the guideline's recommendation (e.g. 'class I').
recommendedIntake					DietarySupplement	RecommendedDoseSchedule				Recommended intake of this supplement for a given population as defined by a specific recommending authority.
recordLabel			http://purl.org/ontology/mo/label		MusicRelease	Organization				The label that issued the release.
recordedAs					MusicComposition	MusicRecording	recordingOf			An audio recording of the work.
recordedAt					CreativeWork	Event	recordedIn			The Event where the CreativeWork was recorded. The CreativeWork may capture all or part of the event.
recordedIn					Event	CreativeWork	recordedAt			The CreativeWork that captured all or part of this Event.
recordingOf					MusicRecording	MusicComposition	recordedAs			The composition this track is a recording of.
recourseLoan	pending:				LoanOrCredit	Boolean				The only way you get the money back in the event of default is the security. Recourse is where you still have the opportunity to go back to the borrower for the rest of the money.
referenceQuantity					UnitPriceSpecification	QuantitativeValue				The reference quantity for which a certain price applies, e.g. 1 EUR per 4 kWh of electricity. This property is a replacement for unitOfMeasurement for the advanced cases where the price does not relate to a standard unit.
referencesOrder					Invoice	Order				The Order(s) related to this Invoice. One or more Orders may be combined into a single Invoice.
refundType	pending:				MerchantReturnPolicy	RefundTypeEnumeration				A refund type, from an enumerated list.
regionDrained					LymphaticVessel, Vein	AnatomicalStructure, AnatomicalSystem				"The anatomical or organ system drained by this vessel; generally refers to a specific part of an organ."
regionsAllowed					MediaObject	Place				"The regions where the media is allowed. If not specified, then it's assumed to be allowed everywhere. Specify the countries in <a href=""http://en.wikipedia.org/wiki/ISO_3166"">ISO 3166 format</a>."
relatedAnatomy					SuperficialAnatomy	AnatomicalStructure, AnatomicalSystem				Anatomical systems or structures that relate to the superficial anatomy.
relatedCondition					AnatomicalStructure, AnatomicalSystem, SuperficialAnatomy	MedicalCondition				A medical condition associated with this anatomy.
relatedDrug					Drug	Drug				Any other drug related to this one, for example commonly-prescribed alternatives.
relatedLink					WebPage	URL				A link related to this web page, for example to other related web pages.
relatedStructure					AnatomicalSystem	AnatomicalStructure				Related anatomical structure(s) that are not part of the system but relate or connect to it, such as vascular bundles associated with an organ system.
relatedTherapy					AnatomicalStructure, AnatomicalSystem, SuperficialAnatomy	MedicalTherapy				A medical therapy related to this anatomy.
relatedTo					Person	Person				The most generic familial relation.
releaseDate					Product	Date				The release date of a product or product model. This can be used to distinguish the exact variant of a product.
releaseNotes					SoftwareApplication	Text, URL				Description of what changed in this version.
releaseOf					MusicRelease	MusicAlbum	albumRelease			The album this is a release of.
releasedEvent					CreativeWork	PublicationEvent				The place and time the release was issued, expressed as a PublicationEvent.
relevantOccupation					JobPosting	Occupation				The Occupation for the JobPosting.
relevantSpecialty					MedicalEntity	MedicalSpecialty				If applicable, a medical specialty in which this entity is relevant.
remainingAttendeeCapacity					Event	Integer				The number of attendee places for an event that remain unallocated.
renegotiableLoan	pending:				LoanOrCredit	Boolean				Whether the terms for payment of interest can be renegotiated during the life of the loan.
repeatCount	pending:				Schedule	Integer				"Defines the number of times a recurring <a class=""localLink"" href=""/Event"">Event</a> will take place."
repeatFrequency	pending:	frequency			Schedule	Duration, Text				"Defines the frequency at which <a class=""localLink"" href=""/Event"">Event</a>s will occur according to a schedule <a class=""localLink"" href=""/Schedule"">Schedule</a>. The intervals between
      events should be defined as a <a class=""localLink"" href=""/Duration"">Duration</a> of time."
repetitions					ExercisePlan	Number, QuantitativeValue				Number of times one should repeat the activity.
replacee		object			ReplaceAction	Thing				A sub property of object. The object that is being replaced.
replacer		object			ReplaceAction	Thing				A sub property of object. The object that replaces.
replyToUrl					UserComments	URL				The URL at which a reply may be posted to the specified UserComment.
reportNumber					Report	Text				The number or other unique designator assigned to a Report by the publishing organization.
representativeOfPage					ImageObject	Boolean				Indicates whether this image is representative of the content of the page.
requiredCollateral					LoanOrCredit	Text, Thing				Assets required to secure loan or credit repayments. It may take form of third party pledge, goods, financial instruments (cash, securities, etc.)
requiredGender					PeopleAudience	Text				Audiences defined by a person's gender.
requiredMaxAge					PeopleAudience	Integer				Audiences defined by a person's maximum age.
requiredMinAge					PeopleAudience	Integer				Audiences defined by a person's minimum age.
requiredQuantity					HowToItem	Number, QuantitativeValue, Text				The required quantity of the item(s).
requirements					SoftwareApplication	Text, URL			softwareRequirements	Component dependency requirements for application. This includes runtime environments and shared libraries that are not included in the application distribution package, but required to run the application (examples: DirectX, Java or .NET runtime).
requiresSubscription					ActionAccessSpecification, MediaObject	Boolean, MediaSubscription				Indicates if use of the media require a subscription  (either paid or free). Allowed values are <code>true</code> or <code>false</code> (note that an earlier version had 'yes', 'no').
reservationFor					Reservation	Thing				The thing -- flight, event, restaurant, etc. being reserved.
reservationId					Reservation	Text				A unique identifier for the reservation.
reservationStatus					Reservation	ReservationStatusType				The current status of the reservation.
reservedTicket					Reservation	Ticket				A ticket associated with the reservation.
responsibilities					JobPosting, Occupation	Text				Responsibilities associated with this role or Occupation.
restPeriods					ExercisePlan	QuantitativeValue, Text				How often one should break from the activity.
restockingFee	pending:				MerchantReturnPolicy	MonetaryAmount, Number				"Use <a class=""localLink"" href=""/MonetaryAmount"">MonetaryAmount</a> to specify a fixed restocking fee for product returns, or use <a class=""localLink"" href=""/Number"">Number</a> to specify a percentage of the product price paid by the customer."
result				resultComment, resultReview	Action	Thing				The result produced in the action. E.g. John wrote <em>a book</em>.
resultComment		result			CommentAction, ReplyAction	Comment				A sub property of result. The Comment created or sent as a result of this action.
resultReview		result			ReviewAction	Review				A sub property of result. The review that resulted in the performing of the action.
returnFees	pending:				MerchantReturnPolicy	ReturnFeesEnumeration				The type of return fees for purchased products (for any return reason).
returnLabelSource	pending:				MerchantReturnPolicy	ReturnLabelSourceEnumeration				The method (from an enumeration) by which the customer obtains a return shipping label for a product returned for any reason.
returnMethod	pending:				MerchantReturnPolicy	ReturnMethodEnumeration				The type of return method offered, specified from an enumeration.
returnPolicyCategory	pending:				MerchantReturnPolicy, MerchantReturnPolicySeasonalOverride	MerchantReturnEnumeration				Specifies an applicable return policy (from an enumeration).
returnPolicyCountry	pending:				MerchantReturnPolicy	Country, Text				"The country where the product has to be sent to for returns, for example ""Ireland"" using the <a class=""localLink"" href=""/name"">name</a> property of <a class=""localLink"" href=""/Country"">Country</a>. You can also provide the two-letter <a href=""http://en.wikipedia.org/wiki/ISO_3166-1"">ISO 3166-1 alpha-2 country code</a>. Note that this can be different from the country where the product was originally shipped from or sent to."
returnPolicySeasonalOverride	pending:				MerchantReturnPolicy	MerchantReturnPolicySeasonalOverride				Seasonal override of a return policy.
returnShippingFeesAmount	pending:				MerchantReturnPolicy	MonetaryAmount				"Amount of shipping costs for product returns (for any reason). Applicable when property <a class=""localLink"" href=""/returnFees"">returnFees</a> equals <a class=""localLink"" href=""/ReturnShippingFees"">ReturnShippingFees</a>."
review					Brand, CreativeWork, Event, Offer, Organization, Place, Product, Service	Review		reviews		A review of the item.
reviewAspect					Guide, Rating, Review	Text				This Review or Rating is relevant to this part or facet of the itemReviewed.
reviewBody					Review	Text				The actual body of the review.
reviewCount					AggregateRating	Integer				The count of total number of reviews.
reviewRating					Review	Rating				"The rating given in this review. Note that reviews can themselves be rated. The <code>reviewRating</code> applies to rating given by the review. The <a class=""localLink"" href=""/aggregateRating"">aggregateRating</a> property applies to the review itself, as a creative work."
